tweet_id,user,text,date,retweets,replies,likes,quotes,has_viz
1364743888997548035,BillGates,"I’m looking forward to joining @andrewrsorkin to talk about climate change, our foundation’s work in response to the pandemic, and more. https://t.co/P4PKAq8Bef",02/25/2021 01:07:53,288,0,2896,85,False
1364604015103778820,BillGates,Thanks @JudyWoodruff and @NewsHour for having me on the show to talk about climate change and COVID-19 – two urgent global issues that need global collaboration. https://t.co/gGH7XR9yGW,02/24/2021 15:52:04,270,1,2542,63,False
1364346661846343688,BillGates,"RT @melindagates: I’m grateful for new commitments from the EU, Germany, Canada, Japan, and the U.S. to help make safe and effective COVID-…",02/23/2021 22:49:27,266,0,0,0,False
1362908871627399168,BillGates,"RT @washingtonpost: Bill Gates on Climate Change, Covid and Whether He Has Too Much Influence https://t.co/SIE5MGjff5",02/19/2021 23:36:11,272,0,0,0,False
1357390964180930565,BillGates,"RT @melindagates: In 2020, global health went local. 

COVID-19 has shown us that what happens in one part of the world matters to the rest…",02/04/2021 18:09:59,566,0,0,0,False
1356374923078369281,BillGates,"When it comes to preventing pandemics, scientific tools alone aren’t enough. We also need new capabilities, including a global alert system and infectious disease first responders (or what I like to call a pandemic fire squad): https://t.co/53Rf5uvjub https://t.co/rTmM7STl6U",02/01/2021 22:52:36,1659,0,7918,2296,True
