tweet_id,user,text,date,retweets,replies,likes,quotes,has_viz
1486834704724676611,JeromeAdamsMD,"RT @JeromeAdamsMD: Today’s IDK who needs to hear this: COVID isn’t going away-  there will continue to be new variants! 

To move forward w…",01/27/2022 22:53:12,105,0,0,0,False
1486687580238274562,JeromeAdamsMD,"Today’s IDK who needs to hear this: COVID isn’t going away-  there will continue to be new variants! 

To move forward we need to promote three doses and then move to an annual fall update. 

Scientists are monitoring a new omicron subvariant called BA.2 https://t.co/JBCoxkgNWJ",01/27/2022 13:08:35,105,93,432,10,False
1486469684446720000,JeromeAdamsMD,"“Conventional wisdom held that distrust of health systems &amp; misinformation kept Covid vaccines from going into arms in Black communities. But new evidence shows that hesitancy there waned faster than in white communities -
which could inform future appeals about new treatments.” https://t.co/Bj9V2suokW",01/26/2022 22:42:44,9,3,26,0,False
1486467401776447492,JeromeAdamsMD,"@nick13129361 @DevWallace1 The rules definitely are both confusing and haven’t caught up with the science. But they said, the bigger problem in Indiana schools is even if your kid is there, there’s a good chance their teacher is out with covid.  Over 100 teachers out one day last week in HSE.",01/26/2022 22:33:40,0,3,0,0,False
1486456234848837633,JeromeAdamsMD,@DevWallace1 Restating this- Where are kids actually being forced  to get vaccinated against covid to attend class in public schools? I’ve always said we shouldn’t mandate vaccines in kids while under EUA.,01/26/2022 21:49:18,0,5,6,0,False
1486440268685398016,JeromeAdamsMD,"@MountainManual And that my friend is why this pandemic is lingering on so long.  Again, if Joe had an expert fireman on his show, and your house was on fire, I’m guessing you wouldn’t say “but Joe Rogan said…” to the fireman at your house. Or maybe you would…🤔",01/26/2022 20:45:51,0,3,1,0,False
1486334056136462341,JeromeAdamsMD,"Covid treatments are a great airbag- only helpful after you’ve already crashed- may help, but may not. 

But vaccines are like the collision avoidance systems in your car- they prevent you from getting in an accident in the first place.",01/26/2022 13:43:48,17,7,106,2,False
1485429017838821381,JeromeAdamsMD,"RT @JeromeAdamsMD: Todays “ I don’t know who needs to hear this:”

A kid w/ appendicitis who tests positive before surgery is “with” covid.…",01/24/2022 01:47:30,78,0,0,0,False
1485406359491424256,JeromeAdamsMD,I’ve actually called for this even pre-pandemic. Studies show the summer “slide” often accounts for more of the difference in educational achievement than the quality of schools does. 🤯,01/24/2022 00:17:28,4,4,28,0,False
