tweet_id,user,text,date,retweets,replies,likes,quotes,has_viz
1277201280969080833,profvrr,"On the latest episode of the #science #podcast This Week in Virology #TWiV Daniel Griffin provides a clinical update on #COVID19 then we review #sars_cov2 infections in non-humans, vesicular stomatitis in Kansas horses, and answer listener questions https://t.co/fKZyxIyL4F https://t.co/sLifY6pv1k",06/28/2020 11:24:49,34,16,94,5,True
1274671744435904512,profvrr,"On the latest #TWiV Daniel Griffin's clinical update on #COVID19, dexamethasone trial, two Ebolavirus outbreaks in DRC, clinical and virological aspects of asymptomatic #SARSCoV2 infections, age-dependent effects on transmission, and listener email. https://t.co/hzYOX1sihR https://t.co/A6DGo6xAay",06/21/2020 11:53:20,51,3,88,4,True
1273564902314164226,profvrr,"On the latest #TWiV we discuss #SARSCoV2 D614G amino acid change in spike glyprotein, duration of infectious virus shedding from patients, virus transmission among hamsters infected in the laboratory, and tackle listener email https://t.co/TfUMvXJOSo #COVID19 https://t.co/0RUqGEqiom",06/18/2020 10:35:09,56,5,112,1,True
1272249752789409795,profvrr,"Daniel Griffin provides a clinical update on COVID-19, then Ralph Baric joins #TWiV to discuss #SARSCoV2 transmission, vaccines, diagnostic tests, and a new animal model from his laboratory that does not use transgenic mice https://t.co/mEgrp7Jegc https://t.co/3fMReKo8UQ",06/14/2020 19:29:12,54,11,118,8,True
1270712614570659840,profvrr,"Paul Stays Home, the free illustrated childrens book about #COVID19 and #SARSCoV2 is now available in English, Spanish, Greek, Italian, French, and Persian https://t.co/LK8Ssct3k7 @profsuslopez @Viro_ConacytMX https://t.co/ds2xUN2D63",06/10/2020 13:41:10,53,5,89,3,True
1269592561854881797,profvrr,"On the latest episode of the #science #podcast This Week in Virology #TWiV Daniel Griffin provides a clinical update on #COVID19 then Sabra Klein joins us to discuss the effect of sex, gender, and age on viral infectious disease, including #COVID19  https://t.co/IBReVA9fK2 https://t.co/Qxh7oFeLES",06/07/2020 11:30:29,50,6,145,13,True
1268536434601988097,profvrr,Want to know the real reason NIH withdrew @EcoHealthNYC grant to study #coronavirus in bats in China? Listen to @PeterDaszak on the latest #TWiV This Week in Virology #science #podcast #grumpyvirologists  providing information needed to prevent future pandemics https://t.co/uMDchz5z6N,06/04/2020 13:33:48,52,7,179,13,True
1267263868209954816,profvrr,"On the latest #TWiV Daniel Griffin's clinical update on #COVIDー19 an Ad5 vectored #SARSCoV2 vaccine, reports on remdesivir and hydroxychloroquine, a drug repurposing study, why some patients infect many others, reducing viral transmission, and much more https://t.co/JQTF1h3RjW https://t.co/THTw6phOcT",06/01/2020 01:17:05,43,5,91,4,True
