tweet_id,user,text,date,retweets,replies,likes,quotes,has_viz
1288132191520792577,T_Inglesby,"RT @AbraarKaran: We need more public-facing outbreak investigations database for #covid19.

Where outbreaks happened (location, indoors/out…",07/28/2020 15:20:21,33,0,0,0,False
1286500528122474496,T_Inglesby,"A good development. It’s so clear that there should not be large political rallies in the US right now, given the #COVID risks.   https://t.co/yWOuxWPUWh",07/24/2020 03:16:42,6,7,46,1,False
1286047787969372160,T_Inglesby,"RT @MMFill: This isn't a great take from @TheDailyShow. Saying that COVID-19 ""can't hurt kids"" sets unrealistic expectations for the public…",07/22/2020 21:17:40,14,0,0,0,False
1285714846936379393,T_Inglesby,"RT @DrTomFrieden: When we start measuring-and publicizing-the essential metrics of Covid risk and control, we'll make much more progress. I…",07/21/2020 23:14:41,420,0,0,0,False
1285714597882875905,T_Inglesby,"RT @JAMA_current: #COVID19 continues to spread aggressively in Brazil, Peru, &amp; Chile as the countries face a shortage of PPE for health wor…",07/21/2020 23:13:42,26,0,0,0,False
1285714438847332358,T_Inglesby,"RT @KFF: As of 5:54 p.m. ET, here's the data for #COVID19 in the U.S. today. 
• Total confirmed cases: 3,884,988
• Cases per 1M population:…",07/21/2020 23:13:04,7,0,0,0,False
1285713045755437061,T_Inglesby,A big concern from the event:  why no scientists or public health officials at the podium?  There continues to be very little opportunity for the press/public to interact with public health leaders in the middle of a pandemic.11/x,07/21/2020 23:07:32,15,2,63,0,False
1285711828157374464,T_Inglesby,What would have been useful for the president to say more clearly is what the Administration is going to do differently now to get this pandemic crisis under control. What is going to change now. 7/x,07/21/2020 23:02:41,7,1,53,0,False
1285711718652563458,T_Inglesby,Important to hear president offer direct statement that the pandemic is likely to get worse before it's going to get better. This is very different from inaccurate statements made by White House in last couple weeks that things were going very well in the US response.6/x,07/21/2020 23:02:15,7,2,46,0,False
1285709934794080256,T_Inglesby,"The president spoke this afternoon about the US response to the coronavirus pandemic.  There were a number of welcome public health-grounded messages.  But there are places where he needed to go further, or to clarify or ask more from governors.1/x",07/21/2020 22:55:10,49,19,134,13,False
1285686020063756298,T_Inglesby,"Such COVID disparity within same city: “In Houston neighborhood of Gulfton, more than 45,000 restaurant workers and housekeepers, immigrants and refugees live close together...At least 965 have been infected...far more per capita than city as a whole.” https://t.co/cVBpxYgF1a",07/21/2020 21:20:08,45,2,49,1,False
1285673690672386048,T_Inglesby,"“Six months after the coronavirus appeared in America, the nation has failed spectacularly to contain it. The country’s ineffective response has shocked observers around the planet. Many countries have rigorously driven infection rates nearly to zero. “ https://t.co/uvJhS6lSBH",07/21/2020 20:31:09,64,5,126,1,False
1285550640995893248,T_Inglesby,"How Sweden is on wrong track for Covid (things in common w/ erratic communications of  leaders in US:) “importance of testing has been played down for a long time ..still refuses to recommend masks in public, despite overwhelming evidence of effectiveness” https://t.co/Fn1ZWg5t0u",07/21/2020 12:22:11,51,5,81,4,False
1285037037087858688,T_Inglesby,Church leaders that invite churchgoers back inside an indoor church when there is ongoing substantial community transmission of COVID are increasing the risk of those people getting COVID. Churchmembers should understand the risks from their health depts before they attend https://t.co/8MUNKf068Y,07/20/2020 02:21:19,86,13,212,8,False
1284497732414169090,T_Inglesby,"RT @HoltgraveHealth: From CNN: ""Can't shake Covid-19: Warnings from young survivors still suffering"" 

https://t.co/Yglwozz9yr",07/18/2020 14:38:18,51,0,0,0,False
1284497444173209606,T_Inglesby,This report should be public. People should know what actions the White House coronavirus task force is recommending for states doing most poorly in COVID.  Governors need to explain to their people why they aren't following them. https://t.co/ce9Jvpvst2,07/18/2020 14:37:10,313,13,569,18,False
1284103866678751238,T_Inglesby,"RT @ScottGottliebMD: Now that we’re no longer deliberately sheltering kids from Covid as camps and other venues reopen, infection rates amo…",07/17/2020 12:33:13,1321,0,0,0,False
1283220588316721154,T_Inglesby,RT @bethlinas: This is a FABULOUS piece that includes the #hardtruths of how we  still beat back #COVID19. @nataliexdean @SaskiaPopescu @T_…,07/15/2020 02:03:23,10,0,0,0,False
1282350356371050497,T_Inglesby,"Harrowing, moving account of impact of COVID on the Navajo, &amp; how it took advantage of generations of government-led injustices against its people. This terrible experience w/ COVID should spur the US to change the way it treats its indigenous populations 
https://t.co/NbkrVz0y7I",07/12/2020 16:25:24,208,14,327,3,False
1281998198345736201,T_Inglesby,"Vietnam, country of 95M that has border w/ China, has 0 COVID deaths, avg of &lt;10 cases/day. How? stay at home orders at start, extensive testing+contact tracing, clear communication, strict mask use. Has allowed them to reopen. Great report by @Ep1Chrissy  https://t.co/HKm5JV4iJK",07/11/2020 17:06:03,3479,240,7904,334,False
1281725374829928448,T_Inglesby,RT @JenniferNuzzo: “Slemp said the staffing numbers were even worse than that when the pandemic hit because between 20% to 25% of all healt…,07/10/2020 23:01:57,30,0,0,0,False
1281686911480930304,T_Inglesby,"RT @JobyWarrick: An ""adverse-force multiplier"": From ethnic and regional conflicts to home-grown extremism, covid-19 has a way of making ne…",07/10/2020 20:29:06,16,0,0,0,False
1281679631352045568,T_Inglesby,"No he really doesn't make a lot of mistakes.  He bases his views on COVID on science.  As new science emerges, he may change his views, as he should.  Undercutting one of the top federal scientists on COVID is a sad road to a worsening COVID crisis.  https://t.co/ELrONfRuyG",07/10/2020 20:00:11,2257,601,7160,241,False
1281677286039748608,T_Inglesby,West VA would be far better off w/ Dr. Slemp still leading COVID pub health response. Article gives glimpse of the changes she was trying to bring to public health there. Not referenced here-the very positive metrics around her leadership of COVID there   https://t.co/n3IRbBNnIF,07/10/2020 19:50:52,17,4,37,2,False
1281034316617826308,T_Inglesby,"RT @ASlavitt: COVID Update July 8: Today I testified publicly to the MN House Committee on the Pandemic.

My remarks ended with 5 pieces of…",07/09/2020 01:15:56,3838,0,0,0,False
1281000906385915904,T_Inglesby,Also unclear answers given when reporters asked what schools should do if there is substantial community transmission of COVID occurring within a school district.6/x,07/08/2020 23:03:10,10,7,54,0,False
1280998688329027585,T_Inglesby,"At White House Coronavirus task force meeting today, they described how each governor is given detailed data on regular basis about it's COVID numbers, statistics etc.  That data should be made available to public so they can understand their own risks.1/x https://t.co/3IkrLwczJU",07/08/2020 22:54:21,57,10,196,1,False
1280862545902010368,T_Inglesby,"RT @amymaxmen: More than 1,600 people have #COVID19, 6 are dead &amp; more will be, because officials presiding over #SanQuentin prison turned…",07/08/2020 13:53:22,361,0,0,0,False
1280651289127510016,T_Inglesby,"""She blamed the latest wave in large part on Israel's swift reopening of schools in May and wedding venues in June.
Prime Minister Benjamin Netanyahu had declared victory over the pandemic in May and encouraged Israelis to go out and 'enjoy yourselves.' "" https://t.co/83Coj9xv1O",07/07/2020 23:53:55,46,9,66,11,False
1280628157733888002,T_Inglesby,"There have been some schools opened in other parts of world which have had minimal or no reported outbreaks, which is reassuring (though some of those schools are operating in very low COVID prevalence settings – the opposite of situation in many places in the US right now.)6/x",07/07/2020 22:22:00,27,4,166,1,False
1280628003475795969,T_Inglesby,"Various models have concluded the opposite – some say that schools will accelerate COVID outbreaks, others conclude they won’t. 5/x",07/07/2020 22:21:23,30,4,125,1,False
1280627614932140032,T_Inglesby,Children are at far lower risk of serious illness than adults in terms of COVID19.  But we still don’t have enough evidence about how frequently children spread COVID to other children. Or how frequently children spread the disease to adults in school or adults in their homes.3/x,07/07/2020 22:19:50,67,12,278,8,False
1280627393552691200,T_Inglesby,Schools are extraordinarily important and we should work to open them safely in the fall.  But mtg today had no one expressing concerns of so many parents+teachers. And no one talking about what is known /not known about the science related to schools and COVID spread.2/x,07/07/2020 22:18:58,101,24,419,7,False
